{
  "schema_version": "0.2",
  "case_id": "MECH-004",
  "workflow_id": "WF-BOM-RECONCILIATION",
  "title": "Drawing parts list and procurement BOM reconciliation",
  "task_spec": "specs/tasks/bom_reconciliation_v1.json",
  "environment_spec": "specs/environments/local_files_v1.json",
  "evaluator_spec": "specs/evaluators/bom_reconciliation_v1.json",
  "input_dir": "cases/MECH-004/input",
  "reference_dir": "cases/MECH-004/reference",
  "metadata": {
    "domain": "mechanical_engineering",
    "difficulty": "intermediate",
    "dataset_split": "development",
    "synthetic": true,
    "review_status": "reviewed",
    "created_date": "2026-07-05",
    "failure_modes": [
      "MISSING_ITEM",
      "EXTRA_ITEM",
      "QUANTITY_MISMATCH",
      "WRONG_REVISION",
      "MISSING_CONSTRAINT",
      "FAILURE_TO_VERIFY"
    ],
    "tags": [
      "bom",
      "parts-list",
      "procurement",
      "cross-document-consistency",
      "qa-qc"
    ],
    "lineage": {
      "kind": "seed",
      "parent_case_id": null,
      "change_note": "Initial manually authored cross-document reconciliation case."
    }
  }
}
